reviewId,userName,userImage,content,score,thumbsUpCount,reviewCreatedVersion,at,replyContent,repliedAt,appVersion
b40f4dac-c663-45cb-8b27-9549f98778b2,정**,https://play-lh.googleusercontent.com/a-/ALV-UjU8PzI-70nH4RrMimRAOqTxpxe9ZJbVP08E2j_eM84FqQjzgf7i,아니 도대체 뭐 어쩌라는거야 왜 잘못 눌려지는건데 왜 틀린거냐고 그리고 왜 쉬움인데 왜 이렇게 어럽냐고,1,0,,2025-12-01 18:04:32,"안녕하세요, 불편을 끼쳐드려 정말 죄송합니다. 만약 불편하시다면 sudoku@fungame.studio로 문제에 대한 자세한 내용을 보내주시겠어요? 수도쿠를 제대로 즐길 수 있도록 최선을 다하겠습니다. 따뜻한 응원에 진심으로 감사드립니다! :-) - 릴리",2025-12-01 18:54:36,
bba4fc00-7956-4bc1-8fd4-12b01ac80b5d,s*****,https://play-lh.googleusercontent.com/a/ACg8ocLGT_HDJhKap_x5JxLvK2RtsicU95DavVd4tiSTXz5AD7PT7g=mo,너무 좋은데 설정에 전략 부분도 한국어 해석되어있으면 좋겠습니다.,4,0,5.0.2,2025-11-30 21:43:44,"안녕하세요, 따뜻한 성원에 진심으로 감사드립니다. 개발팀과 제품팀에 요청 사항을 전달했으며, 더 나은 사용자 경험을 제공하기 위해 앱을 지속적으로 업데이트할 예정입니다. 기타 의견은 sudoku@fungame.studio로 보내주세요. 다시 한번 감사드립니다! :-) - 릴리",2025-12-01 18:57:49,5.0.2
1bd26899-b17f-4942-ae7b-a555d5ee0edd,안*,https://play-lh.googleusercontent.com/a-/ALV-UjWC_F_t-mhgGa9jZNULrsR5RzlTQrCSPx-KHkqdYgnfWRI4kSTe,재밌어요,5,0,5.0.2,2025-11-30 20:53:06,"안녕하세요, 친절한 말씀과 5성 리뷰 감사합니다! 저희 앱을 즐기고 계신다니 기쁩니다. 계속 사용해 주시고 피드백이 있으시면 언제든지 sudoku@fungame.studio로 연락 주세요. :-) - May",2025-12-01 09:30:51,5.0.2
6c21883e-a7ce-4515-a6bd-b35ce7887b7b,우*****,https://play-lh.googleusercontent.com/a-/ALV-UjWmq56gOwMpkyaesN-nT6WqjKj9h0Kons2nY2B0SK1luvDJh78h,최고!!,5,0,5.0.2,2025-11-30 16:14:21,"안녕하세요, 격려의 별점에 기쁩니다! 저희 앱이 여러분의 삶을 더 편리하게 만들어 드려 기쁩니다. 추가 피드백이 있으시면 언제든지 sudoku@fungame.studio로 연락 주세요! :-) - May",2025-11-30 19:30:36,5.0.2
852b0435-a060-4fda-acbb-81ec1cbe51d1,강**,https://play-lh.googleusercontent.com/a/ACg8ocIO2ldY6bcjbRBphOpEDTLZ4zHSTGvejIPHY_UZkrJfLz5vPQ=mo,감사합니다,4,0,5.0.2,2025-11-30 11:20:41,"안녕하세요, 많은 지원에 감사드립니다! 스타트업으로서 모든 리뷰가 매우 중요합니다. 개선할 방법이 있다면 언제든지 sudoku@fungame.studio로 피드백을 보내 주세요. 계속해서 개선하여 5번째 별을 받을 수 있도록 하겠습니다! 감사합니다! :-) - May",2025-11-30 15:30:28,5.0.2
7155fca4-d87c-4f81-a847-bcb03bcdd29b,유**,https://play-lh.googleusercontent.com/a/ACg8ocIY9JyXr0tnbgsid_eaJyHrdAvwKA7kT4UydMRbzlsymzKkGA=mo,굳,5,0,3.8.4,2025-11-29 18:30:59,"안녕하세요, 멋진 5성 리뷰 감사합니다! 저희 앱이 기대를 초과하고 있어 기쁩니다. 도움이 필요하시면 언제든지 sudoku@fungame.studio로 연락 주세요. :-) - May",2025-11-29 19:30:21,3.8.4
26ff782f-0e14-4320-ae1b-5407eaea9b2c,C**********,https://play-lh.googleusercontent.com/a/ACg8ocI4LbC_62zN6iNUpcRw8Wqp6neeRAbrOL43fwwP6272DaujEA=mo,광고가 없다고해서 설치했는데 한판 끝날때마다 광고는 무조건 나오고 중간에도 가끔씩 나옴니다.,4,0,5.0.2,2025-11-29 06:06:43,"안녕하세요, 불편을 드려 죄송합니다. 스타트업으로서 저희는 광고 연동을 통해 생존하고 향후 개발을 지원해야 합니다. 일부 광고는 5초 시청 후 건너뛸 수 있습니다. ""광고 제거"" 서비스를 구매하시면 광고 없는 게임을 즐기실 수 있습니다. 다른 문의 사항이 있으시면 sudoku@fungame.studio로 연락 주세요. 감사합니다. :-) - Lily",2025-11-29 17:40:07,5.0.2
48ee259a-8d38-4e95-97cc-cbbeed6634b9,박**,https://play-lh.googleusercontent.com/a/ACg8ocL6WImnuq6oDO-xaDpzxR56PK9QqInyMGzii48pM3388W30cQ=mo,광고가 너무 많아서 게임하기 힘듬,1,0,,2025-11-27 21:05:01,"안녕하세요, 불편을 드려 죄송합니다. 저희는 스타트업으로서 광고에 의존하고 있습니다. 일부 광고는 5초 시청 후 건너뛸 수 있습니다. 다른 문의 사항이 있으시면 sudoku@fungame.studio로 연락 주세요. 여러분의 성원과 이해에 진심으로 감사드립니다! :-) - 릴리",2025-11-28 17:32:25,
d598ef2d-c8fd-474a-9686-947aeeec829e,서**,https://play-lh.googleusercontent.com/a/ACg8ocLM9fe-sv4Kb8CAGrBlc6JrWXV_oFMFRYqE2sbqrIzlLXinOA=mo,오류개많음,1,0,5.0.2,2025-11-27 16:08:09,"안녕하세요, 불편을 끼쳐드려 죄송합니다. 모든 퍼즐은 풀 수 있도록 테스트되었습니다. 막히면 힌트 기능을 사용해 보세요. 퍼즐 페이지 오른쪽 하단에 있습니다. 다른 문제가 있으시면 sudoku@fungame.studio로 문제에 대한 자세한 내용을 보내주세요. 정말 감사합니다! :-) - Lily",2025-11-28 17:32:57,5.0.2
f25bf395-3dff-433b-bde2-5d71cfdb7f5d,정**,https://play-lh.googleusercontent.com/a/ACg8ocLRUaojvBZNKoImfjErmPpT8QZNj-JyBQ4gkxk4ToeBNhekQw=mo,진짜 재밌고 공부까지 되니까 할거없고 심심한데 갓생사시고싶으신 분들은 이거하세요,5,0,5.0.2,2025-11-26 21:39:09,"안녕하세요, 친절한 말씀에 정말 감사드립니다! 피드백이나 제안이 있으시면 언제든지 sudoku@fungame.studio로 연락 주세요. 더 나은 게임 경험을 제공하기 위해 계속해서 앱을 최적화하겠습니다. 많은 지원에 감사드립니다! :-) - May",2025-11-27 09:30:55,5.0.2
e0aee6a9-b201-4b91-9631-a08378ceca07,박*********,https://play-lh.googleusercontent.com/a-/ALV-UjWN3uUBB4yd4RcKX4-Q0GFhm0Kjdr0SXktWS1kxPzwHX35oCcA5,광고줌 적당히,5,0,5.0.2,2025-11-26 09:16:56,,,5.0.2
3a8e742c-38e6-441d-acd1-00515bf9a2ff,ᄋ*,https://play-lh.googleusercontent.com/a/ACg8ocJ1jgjIu-4MF9oHqg_JmxFRs0Vp3k75Ty0zKDlo2RNfsR-W3A=mo,good,5,0,5.0.2,2025-11-23 19:01:56,"안녕하세요, 5성 리뷰에 정말 감사드립니다! 저희 앱이 여러분의 필요를 충족시키고 있어 기쁩니다. 도움이 필요하시면 언제든지 sudoku@fungame.studio로 알려 주세요! 좋은 하루 되세요! :-) - May",2025-11-23 19:30:25,5.0.2
858f1664-d0d0-4b53-ab7c-7aeac9bee971,안**,https://play-lh.googleusercontent.com/a/ACg8ocL68oUTyMnv9fHx3fxl8yNW49X3iBitX8QM9FkQGr2x7km2qQ=mo,잠깐 정지했다가 다시하는데도 광고가 생겼네 힌트나 담 스테이지 넘어가는건 광고나와도 알겠는데 이건 너무 불편하다 수시로 계속 정지 눌러야 할 상황이 생기는데 ㅜ,1,0,5.0.2,2025-11-20 09:45:50,"안녕하세요, 불편을 드려 죄송합니다. 저희는 스타트업으로서 광고에 의존하고 있습니다. 일부 광고는 5초 시청 후 건너뛸 수 있습니다. 다른 문의 사항이 있으시면 sudoku@fungame.studio로 연락 주세요. 여러분의 성원과 이해에 진심으로 감사드립니다! :-) - 릴리",2025-11-20 13:21:14,5.0.2
8a56eeea-9cb5-40da-8874-3886ab3bc3e9,한**,https://play-lh.googleusercontent.com/a/ACg8ocJ7vjsfQf2O23xxj7rCe4c5RIIsQ1WwnJThmEK62kLHZ8Wpq5A=mo,두뇌계발에 훌륭,5,0,5.0.2,2025-11-17 10:35:06,"안녕하세요, 멋진 5성 리뷰 감사합니다! 저희 앱이 기대를 초과하고 있어 기쁩니다. 도움이 필요하시면 언제든지 sudoku@fungame.studio로 연락 주세요. :-) - May",2025-11-17 15:30:40,5.0.2
d2fbdc82-7358-43e3-8559-67f5c3f9d84c,빅*******,https://play-lh.googleusercontent.com/a-/ALV-UjX0xhMK89MKQvn6GHDpHFpXEsb0WcqVys6X-XMzJ3l_OF0q58cG,너무 재미있는 게임이네요^^♡,5,0,5.0.2,2025-11-15 20:19:26,"안녕하세요, 여러분의 말씀은 저희에게 큰 힘이 됩니다. 저희 앱을 즐기고 계신다니 기쁩니다. 여러분의 격려는 저희가 계속해서 개선하는 데 큰 동기부여가 됩니다. 다른 것이 필요하시면 언제든지 sudoku@fungame.studio로 연락 주세요. 다시 한 번 감사드리며, 멋진 하루 되세요! :-) - May",2025-11-16 09:30:43,5.0.2
40e34ae8-b2ae-4389-af8a-f19fd4695d2c,*,https://play-lh.googleusercontent.com/a-/ALV-UjULQGr0jpxCZARU9ExWfZ7bAmbEkx5v64X3HOOwPRb2R6YnpVwj,재밌어요,5,0,5.0.2,2025-11-13 12:21:10,"안녕하세요, 격려의 평점과 리뷰를 남겨주셔서 정말 감사합니다! 추가로 도움이 필요하시면 언제든지 sudoku@fungame.studio로 연락 주세요. 멋진 하루 되세요! :-) - May",2025-11-13 15:30:32,5.0.2
0ddfec11-4203-4ff0-b352-ea8ba797ca32,H***********,https://play-lh.googleusercontent.com/a/ACg8ocLmzFXvyotE91LXkcbeme1JHsjlprCdIvH3XHhJrxNzlKXmGw=mo,좋은 앱 감사해요,5,0,5.0.2,2025-11-10 11:37:05,"와우, 5성 리뷰! 저희 앱이 기대를 충족시키고 있어 기쁩니다. 지원해 주셔서 감사드리며, 친절한 리뷰를 작성해 주셔서 감사합니다! :-) - May",2025-11-10 15:30:28,5.0.2
95490c7f-1e7a-4c5f-86d0-5bb3ba5cc07a,현**,https://play-lh.googleusercontent.com/a/ACg8ocIhNoXdw5IPsF6Pw_bkgRbyFR8p1P7JqXcyUCIDpqw-mkBh4Q=mo,굿~머리식히면서 하기좋아요,5,0,5.0.2,2025-11-09 23:41:12,"안녕하세요, 5성 리뷰에 정말 감사드립니다! 저희 앱이 여러분의 필요를 충족시키고 있어 기쁩니다. 도움이 필요하시면 언제든지 sudoku@fungame.studio로 알려 주세요! 좋은 하루 되세요! :-) - May",2025-11-10 09:30:35,5.0.2
e5b659cd-b02b-4cb8-9265-4701fd74af5f,샤***,https://play-lh.googleusercontent.com/a-/ALV-UjXfgZ2VkQJLbixmRxKtCPD3PeSrtIkfdKiF8IegBwAuRBpCKSo,"리뷰 남기기 귀찮아서 안하려고 했는데 조금 놀란 점이 있어서 작성함. 이 게임 힌트 누르면 '가르쳐줌'! 그냥 빈 자리에 이 숫자가 정답이야 하고 띡 알려주는게 아니라 '여기를 보세요, 이 박스와 이 줄이 겹치니까 이 줄 이 칸에는 이 숫자밖에 올 수 없습니다' 라고 가르쳐주고 숫자를 채워줌 이게 굉장히 좋다고 생각함. 공부될 것 같아",5,12,5.0.2,2025-11-07 10:36:17,"안녕하세요, 격려의 평점과 리뷰를 남겨주셔서 정말 감사합니다! 추가로 도움이 필요하시면 언제든지 sudoku@fungame.studio로 연락 주세요. 멋진 하루 되세요! :-) - May",2025-11-07 15:30:36,5.0.2
1e94f2d2-8bc5-4c6d-bc17-4f8290cd835d,임**,https://play-lh.googleusercontent.com/a/ACg8ocISWAGv43p2QOttdEahTeQlYUyJwJcz_su8YPtPDX4k5BWYNQ=mo,난이도나 이런건 좋은데 광고가 넘 많아서 삭제합니다.,4,0,5.0.2,2025-11-04 16:28:52,"안녕하세요, 불편을 드려 죄송합니다. 저희는 스타트업으로서 광고에 의존하고 있습니다. 일부 광고는 5초 시청 후 건너뛸 수 있습니다. 다른 문의 사항이 있으시면 sudoku@fungame.studio로 연락 주세요. 여러분의 성원과 이해에 진심으로 감사드립니다! :-) - 릴리",2025-11-04 18:27:19,5.0.2
84bae2b0-d0eb-423f-bb51-a3efc0fcc068,김**,https://play-lh.googleusercontent.com/a/ACg8ocLOUAdRV0L8JAu9DdT1aFc3lGdp-q-Rv8w-0P8XQkGKGEAocA=mo,기억력이 줄어들때 이 숫자공부 해주면 순간 기억 잘하게 머리회전 도움 주겠죠 ? 머리를 쓰자,5,0,5.0.2,2025-11-01 19:13:15,"안녕하세요, 따뜻한 말씀에 진심으로 감사드립니다. 여러분의 지원은 저희에게 큰 힘이 됩니다. 추가적인 피드백이나 의견이 있으시면 언제든지 환영합니다. sudoku@fungame.studio로 연락해 주세요! 진심으로 감사드립니다! :-) - May",2025-11-01 19:30:24,5.0.2
5f40720f-0b8d-4ea8-a0e4-811b95e99615,에***************,https://play-lh.googleusercontent.com/a-/ALV-UjWWsbnj4np41KsIM4bVQkiqiAlW06hYGowrSqVpAs4lZ9zjsPkD,다른 스도쿠 앱들보다 광고가 적어서 쓰는중 앱 구성은 깔끔함,5,0,5.0.2,2025-11-01 16:20:41,"와우, 5성 리뷰! 저희 앱이 기대를 충족시키고 있어 기쁩니다. 지원해 주셔서 감사드리며, 친절한 리뷰를 작성해 주셔서 감사합니다! :-) - May",2025-11-01 19:30:28,5.0.2
5da29c7d-5628-4dd0-9030-bfb17720e385,우**,https://play-lh.googleusercontent.com/a-/ALV-UjWHfBYm3yiAWKoeBgluPFa1lSW9VWu8P6qteQgIMgjD8E6bYaXb,치매예방 good,5,0,5.0.2,2025-10-31 11:24:16,"안녕하세요, 친절한 말씀과 5성 리뷰 감사합니다! 저희 앱을 즐기고 계신다니 기쁩니다. 계속 사용해 주시고 피드백이 있으시면 언제든지 sudoku@fungame.studio로 연락 주세요. :-) - May",2025-10-31 15:30:35,5.0.2
2b334f62-47c9-4193-9d76-9d7f0104c26a,장****************,https://play-lh.googleusercontent.com/a/ACg8ocI8rWGs1PSYe9kahLCdI4kg6Ghuy1UmHFsPboeE8RH0IUreyg=mo,1818... 테무 광고 때문에 짜증나네,1,1,5.0.2,2025-10-31 10:52:08,"안녕하세요, 불편을 드려 죄송합니다. 해당 광고는 Google, Facebook, Applovin과 같은 외부 광고주가 제공하는 광고입니다. 고객님의 의견을 저희 팀에 전달했습니다. 일부 광고의 경우, ""i""를 클릭하여 광고 제공업체에 신고하시면 광고를 차단하실 수 있습니다. 다른 문제가 있으시면 sudoku@fungame.studio로 문의해 주세요. 감사합니다. :-) - Lily",2025-10-31 17:27:42,5.0.2
59fc6398-bd3d-4463-96d3-9cf2f72bdd5e,김**,https://play-lh.googleusercontent.com/a/ACg8ocJiI8eVaBrerNNypQqLHkQmAHqUbUOMrVSn194YbsT_P9Mbng=mo,좋아요,4,0,5.0.2,2025-10-29 17:48:11,"안녕하세요, 많은 지원에 감사드립니다! 스타트업으로서 모든 리뷰가 매우 중요합니다. 개선할 방법이 있다면 언제든지 sudoku@fungame.studio로 피드백을 보내 주세요. 계속해서 개선하여 5번째 별을 받을 수 있도록 하겠습니다! 감사합니다! :-) - May",2025-10-29 19:30:33,5.0.2
75107ce3-056b-499b-8a9c-c923b7861ea4,김**,https://play-lh.googleusercontent.com/a-/ALV-UjUqpOL5PmJOlxkl7N6T_KR2vlIgaaA7aD2Jce5Av3LquFw9DKi5,광고가 너무 많아요. 퍼즐 하나 풀고 30초 광고 보는거 너무 시간 낭비가 많아요. 광고에 지쳐 앱 지웁니다.,1,0,,2025-10-28 19:21:47,"안녕하세요, 불편을 드려 죄송합니다. 저희는 스타트업으로서 광고에 의존하고 있습니다. 일부 광고는 5초 시청 후 건너뛸 수 있습니다. 다른 문의 사항이 있으시면 sudoku@fungame.studio로 연락 주세요. 여러분의 성원과 이해에 진심으로 감사드립니다! :-) - 릴리",2025-10-29 16:40:16,
acbd1381-915a-4f41-b6c2-cc6dc857da5e,김**,https://play-lh.googleusercontent.com/a/ACg8ocIN32rs0-KtPw4uJ1hQwYH7XpfZptuQFtqTOynDX0ECDJyhbw=mo,좋아요 😀 👍,5,0,5.0.2,2025-10-28 07:30:05,"안녕하세요, 저희 앱을 즐기고 계신다니 매우 기쁩니다! 여러분의 지원을 소중히 여기며, 추가 의견을 환영합니다. 제안이나 질문이 있으시면 언제든지 sudoku@fungame.studio로 연락 주세요. 멋진 하루 되시길 바랍니다! :-) - May",2025-10-28 09:30:43,5.0.2
0397fb5c-9386-4fa7-8374-87d622b54120,김*********,https://play-lh.googleusercontent.com/a/ACg8ocK2LBU5zVUZSDNOw4g5Wy1Bl3nOC1vnGia5qvZwkKNWEdWffg=mo,광고 페이지가 좀 오래 뜨는 것 외엔 좋아요~,5,0,5.0.2,2025-10-25 22:49:10,"안녕하세요, 저희 앱을 사랑해 주셔서 정말 기쁩니다! 지원과 친절한 말씀에 감사드리며, 이는 저희에게 큰 의미가 있습니다! 개선을 위한 제안이 있으시면 sudoku@fungame.studio로 알려 주세요. :-) - May",2025-10-26 09:30:59,5.0.2
18e19114-0502-4046-9f12-5eff393328d6,보**,https://play-lh.googleusercontent.com/a/ACg8ocKFaFbUI4zLb30IASR_u4JuLeCLLGu0ter83mY2BSJOJkRE=mo,광고 시스템이 양아치다,1,0,5.0.2,2025-10-25 10:26:21,"안녕하세요, 불편을 드려 죄송합니다. 스타트업으로서 저희는 광고 연동을 통해 생존하고 향후 개발을 지원해야 합니다. 일부 광고는 5초 시청 후 건너뛸 수 있습니다. ""광고 제거"" 서비스를 구매하시면 광고 없는 게임을 즐기실 수 있습니다. 다른 문의 사항이 있으시면 sudoku@fungame.studio로 연락 주세요. 감사합니다. :-) - Lily",2025-10-25 17:49:16,5.0.2
2dd5e92a-39b6-49f0-9c34-fa4b6e85f19f,윤**,https://play-lh.googleusercontent.com/a/ACg8ocLrbNRfSEmLBKb4Zlv9M2MpeKZnbqxG4g7I0B4j6smHjxUslpI=mo,광고가너무많아요,4,0,5.0.2,2025-10-24 11:11:20,"안녕하세요, 리뷰를 남겨주셔서 감사합니다! 스타트업으로서 저희는 광고 연동을 통해 생존해야 합니다. 광고에 대한 고객님의 피드백을 저희 팀에 전달했으며, 앞으로도 앱을 지속적으로 업데이트할 예정입니다. 다른 문의 사항이 있으시면 sudoku@fungame.studio로 연락주세요. 감사합니다! :-) - Lily",2025-10-24 19:17:09,5.0.2
95282d7b-d813-477b-8444-097a45dbf56e,박**,https://play-lh.googleusercontent.com/a/ACg8ocI5eQ6fcjn1xhRokhpyFz1hE9ZsXJJaTB3TU7V1Xqsb-G00Fg=mo,적당한 레벨 충분히 잘 했어요,5,0,5.0.2,2025-10-22 12:52:19,"안녕하세요, 평가와 리뷰에 정말 감사드립니다! 여러분의 경험을 좋게 만들어드려 기쁩니다. 추가로 도움이 필요하시면 sudoku@fungame.studio로 연락 주시고, 더 나은 경험을 제공할 수 있도록 하겠습니다! 멋진 하루 되세요! :-) - May",2025-10-22 15:30:40,5.0.2
37aa0027-eb66-4294-b3bb-7211a0dfde13,위**,https://play-lh.googleusercontent.com/a/ACg8ocJ4Sx7zLxUEQHyfTAWzXdkh6knKxP83UqbhOYooUuXTeYZhug=mo,악몽 난이도가 재밌고 공략집 노트가 있어 스도쿠 배우기 유용함,5,1,5.0.2,2025-10-21 17:01:21,"안녕하세요, 따뜻한 말씀에 진심으로 감사드립니다. 여러분의 지원은 저희에게 큰 힘이 됩니다. 추가적인 피드백이나 의견이 있으시면 언제든지 환영합니다. sudoku@fungame.studio로 연락해 주세요! 진심으로 감사드립니다! :-) - May",2025-10-21 19:30:22,5.0.2
6b4083bf-36f5-4c26-a626-d518fa55ebb1,이**,https://play-lh.googleusercontent.com/a/ACg8ocLO_-VM5_AKMrmbkKUMwU0nbXWWv_p7NszFvlKwQvE63QrP3w=mo,스도쿠를 좋아하는데. 이렇게 광고도 적당히 나와서 무료로 이용하는 것에 거부감이 없는 것도 좋고 어플자체가 사용하기 쉽고 재미있어서 좋았어요!,5,10,5.0.1,2025-10-17 20:26:30,"안녕하세요, 5성 리뷰에 큰 감사를 드립니다! 저희 앱을 즐기고 계신다니 기쁩니다. 계속 사용해 주시고 다른 제안이 있으시면 sudoku@fungame.studio로 알려 주세요. :-) - May",2025-10-18 09:31:35,5.0.1
e0416b24-6063-410e-a1c7-e40fb62b9afb,글****,https://play-lh.googleusercontent.com/a-/ALV-UjWs69xfpSlCWisU6MIFYWCZhoo6DbfjBIGKmiaW4yfCE-wclq4f,시간 가는줄 모르는 게임,5,0,5.0.1,2025-10-16 06:59:36,"안녕하세요, 5성 리뷰에 큰 감사를 드립니다! 저희 앱을 즐기고 계신다니 기쁩니다. 계속 사용해 주시고 다른 제안이 있으시면 sudoku@fungame.studio로 알려 주세요. :-) - May",2025-10-16 09:31:07,5.0.1
a1769d62-fd9e-48fd-acbe-653fa663851e,조**,https://play-lh.googleusercontent.com/a-/ALV-UjUTRFXxpYsyFqJLunPbXgbwyjyZih47JTTPj6eEqURlWfct4_sL,좋아요,5,0,5.0.1,2025-10-13 14:25:42,"안녕하세요, 격려의 별점에 기쁩니다! 저희 앱이 여러분의 삶을 더 편리하게 만들어 드려 기쁩니다. 추가 피드백이 있으시면 언제든지 sudoku@fungame.studio로 연락 주세요! :-) - May",2025-10-13 15:30:38,5.0.1
c2c48eea-88a0-4a52-80cc-166ccc54a049,박**,https://play-lh.googleusercontent.com/a/ACg8ocJISxgeoVW-sj_4S5m5fzHs08bl_Di8jU6sYARFluuVXvIC7w=mo,광고 적어서 좋네요,5,0,5.0.1,2025-10-13 00:47:38,"안녕하세요, 격려의 별점에 기쁩니다! 저희 앱이 여러분의 삶을 더 편리하게 만들어 드려 기쁩니다. 추가 피드백이 있으시면 언제든지 sudoku@fungame.studio로 연락 주세요! :-) - May",2025-10-13 09:30:49,5.0.1
86eb4b62-3359-4763-bde8-1c6e7cd18296,누**,https://play-lh.googleusercontent.com/a-/ALV-UjU9qWnEGCgYoLYfjOOF4PGpkIbwOFGfj3mLR8YevXOMnLY4YOgr,시간때우기굿,5,0,5.0.1,2025-10-11 11:34:45,"안녕하세요, 평가와 리뷰에 정말 감사드립니다! 여러분의 경험을 좋게 만들어드려 기쁩니다. 추가로 도움이 필요하시면 sudoku@fungame.studio로 연락 주시고, 더 나은 경험을 제공할 수 있도록 하겠습니다! 멋진 하루 되세요! :-) - May",2025-10-11 15:30:29,5.0.1
7828d411-0c73-489e-b4e9-9a78e7a896a6,S***,https://play-lh.googleusercontent.com/a-/ALV-UjXdzDP1OhwS_cnpd6a_t5Oh59aGDDR82jvijJFl-yVO_S_nItE,창의력도 키울 수 잇고 재밌어서 좋아요,5,0,,2025-10-10 18:52:46,"안녕하세요, 저희 앱을 사랑해 주셔서 정말 기쁩니다! 지원과 친절한 말씀에 감사드리며, 이는 저희에게 큰 의미가 있습니다! 개선을 위한 제안이 있으시면 sudoku@fungame.studio로 알려 주세요. :-) - May",2025-10-10 19:30:22,
1a7c4762-4243-40b5-b458-e9f8842ad260,김**,https://play-lh.googleusercontent.com/a/ACg8ocLdR20WYYKq3ew_B-_MrUgE9i36ybrWggsLuFMYLfy_UYqCEg=mo,게임은 역시 스도쿠!!그중에 이 앱이 최곱니다요,5,0,5.0.1,2025-10-10 10:53:34,"안녕하세요, 5성 리뷰에 정말 감사드립니다! 저희 앱이 여러분의 필요를 충족시키고 있어 기쁩니다. 도움이 필요하시면 언제든지 sudoku@fungame.studio로 알려 주세요! 좋은 하루 되세요! :-) - May",2025-10-10 15:30:35,5.0.1
de7b92d8-01b6-40b5-846d-2dd274783544,신**,https://play-lh.googleusercontent.com/a/ACg8ocLnVA7fcrcrdcfeaSHsvsJkhIR_ZGq-oyO790jOopBgnKCv4A=mo,굿^,5,0,5.0.1,2025-10-09 18:37:17,"와우, 5성 리뷰! 저희 앱이 기대를 충족시키고 있어 기쁩니다. 지원해 주셔서 감사드리며, 친절한 리뷰를 작성해 주셔서 감사합니다! :-) - May",2025-10-09 19:30:17,5.0.1
4a1f15e2-fec1-4d05-a4be-9444b3367a13,마**,https://play-lh.googleusercontent.com/a/ACg8ocJjPFERWo26ZJN-ptpZTTw2FbnnEvD-v-Z4C7Yo09N-SIzlow=mo,시간 때우기 좋아요,5,0,4.8.0,2025-10-09 14:58:56,"안녕하세요, 팀 전체가 여러분의 지원에 매우 감사드립니다! 피드백을 소중히 여기며, 개선할 점이 있다면 sudoku@fungame.studio로 연락 주세요! 좋은 하루 되세요! :-) - May",2025-10-09 15:30:31,4.8.0
43727845-de6b-44c8-928f-d643979d88c0,김**,https://play-lh.googleusercontent.com/a-/ALV-UjWjM9YaAGdYh3G-6x_qhNUEAfBnf4FoBRZaTHpVX0YCyUAEFg,스도쿠 좀 더 해보고 작성할게요.,3,0,5.0.1,2025-10-08 12:18:51,"안녕하세요, 리뷰를 남겨주셔서 감사합니다! 스타트업으로서 모든 리뷰는 저희에게 매우 소중합니다. 앞으로 개선할 점이 있다면 언제든지 알려주세요. sudoku@fungame.studio로 피드백을 보내주시면 감사하겠습니다. 저희가 계속해서 개선해 나가면서 더 많은 별점을 받을 수 있기를 바랍니다! 다시 한번 감사드립니다! :-) - Lily",2025-10-08 18:19:36,5.0.1
cbf37d5b-e584-4555-a793-0e1e26aa24c2,s********,https://play-lh.googleusercontent.com/a/ACg8ocJpxbNNfjFbx9fxE0x0Y_h3F4V8PgjUxBwmHDVkwJ0_G10n2w=mo,광고가 너무 많아요ㅡㅡ,1,0,4.6.2,2025-10-08 08:19:28,"안녕하세요, 불편을 드려 죄송합니다. 스타트업으로서 저희는 광고 연동을 통해 생존하고 향후 개발을 지원해야 합니다. 일부 광고는 5초 시청 후 건너뛸 수 있습니다. ""광고 제거"" 서비스를 구매하시면 광고 없는 게임을 즐기실 수 있습니다. 다른 문의 사항이 있으시면 sudoku@fungame.studio로 연락 주세요. 감사합니다. :-) - Lily",2025-10-08 18:20:03,4.6.2
9e614958-fd79-4bd5-94ec-9080a30e888e,r*******,https://play-lh.googleusercontent.com/a-/ALV-UjXEU9vx-q41RTwpQn4k-y1drs0HWfp0LDEthLy4JXbev6LE0nNq_w,광고도 적당하고 난이도가 좋네요,5,2,5.0.1,2025-10-07 09:19:36,"안녕하세요, 5성 리뷰는 저희에게 큰 동기부여가 됩니다. 저희 앱이 긍정적인 경험을 제공하고 있어 기쁩니다. 지원해 주셔서 감사드리며, 친절한 피드백을 남겨 주셔서 감사합니다! :-) - May",2025-10-07 09:31:24,5.0.1
4955f8c5-cd2f-4cba-9303-78cc6b9287fd,김**,https://play-lh.googleusercontent.com/a/ACg8ocJoNkHFE5t3SXq1a8MUXmwzWecXL1T1uaItdf0_Pg7aB5cA0w=mo,광고 잣같아서 지운다. 몇번을 눌러야 꺼지냐? 구글플레이는 무조건 갔다오게 만들어 났네 진짜 거지같은 게임이다.,1,0,,2025-10-04 04:59:38,"안녕하세요, 광고로 인해 불편을 드려 죄송합니다. 다음에 광고가 닫히지 않는 문제가 발생하면 광고의 상세 정보를 담은 영상이나 스크린샷을 sudoku@fungame.studio로 보내주시겠어요? 더 자세히 살펴보고 최선을 다해 해결해 드리겠습니다. 응원해 주셔서 감사합니다. :-) - 릴리",2025-10-04 11:38:00,
ce509937-48e7-46f0-a96b-2e25133ccadc,알*,https://play-lh.googleusercontent.com/a/ACg8ocLqqC45gRK9Zjpp9iHl7X_0FuCNJTpMXMtDU2Bp-aKjnYcSXw=mo,게임은 재밌는데 광고제거 상품은 설명을 좀 제대로 해야할 듯. 기간 없는 영구 광고제거 상품이라 다른 모바일 게임 영구 광고제거 상품처럼 당연히 게임 내 모든 광고가 제거되는 줄 알았는데 자동 광고만 제거되고 리워드 광고는 여전히 봐야하니 속은 느낌이고 개인적으로는 고작 자동 광고만 제거되는 건 줄 알았으면 1.2만원이나 주고 구매 안 했을 거임.,3,0,5.0.1,2025-10-02 05:41:10,"안녕하세요, 불편을 드려 죄송합니다. 광고 제거 서비스는 팝업 광고와 배너 광고를 제거하는 서비스입니다. 하지만 힌트와 고급 노트를 받을 때 표시되는 보너스 영상 광고는 제거할 수 없습니다. 서비스 구매 후에도 팝업 광고나 배너 광고가 계속 표시되면 sudoku@fungame.studio로 문의해 주세요. 감사합니다. - 릴리",2025-10-02 18:25:21,5.0.1
